{
  "version": "0.1.0",
  "timestamp": "2026-10-07T00:00:00Z",
  "previous_version": null,
  "record_count": 2,
  "license": "CC0-1.0",
  "files": [
    {
      "path": "brazil/55-11.bin.zst",
      "sha256": "0000000000000000000000000000000000000000000000000000000000000000",
      "bytes": 512,
      "records": 2
    }
  ],
  "signature": {
    "alg": "Ed25519",
    "public_key_id": "antispam-br-dataset-signing-2026q4",
    "value": "00000000000000000000000000000000000000000000000000000000000000000000000000000000000000000000000000000000000000000000000000000000"
  }
}
